{
  "schemaVersion": 1,
  "balanceVersion": "user-approved-2026-09-12-r3",
  "source": {
    "document": "AETHERIUS - Classes, efeitos, encantamentos",
    "sheet": "Sistema de Leveling",
    "section": 5,
    "snapshot": "AetheriusLevelingSystem - Prompt Codex GPT-5.6 Luna Extra High.pdf"
  },
  "profiles": [
    { "balanceId": "humanoides.bandit", "sourceLabel": "Bandit", "awardMode": "SCALED", "baseXp": 10, "eventXpCategories": ["bandit"], "mappingStatus": "ASSIGNED", "enabled": true, "provenance": "PDF p.10; exact category in AetheriusEnemySystem contract" },
    { "balanceId": "humanoides.riekling", "sourceLabel": "Riekling", "awardMode": "SCALED", "baseXp": 10, "eventXpCategories": ["riekling"], "mappingStatus": "ASSIGNED", "enabled": true, "provenance": "PDF p.10; exact category in AetheriusEnemySystem contract" },
    { "balanceId": "humanoides.silver-hand", "sourceLabel": "Silver Hand", "awardMode": "SCALED", "baseXp": 12, "eventXpCategories": ["silver_hand"], "mappingStatus": "ASSIGNED", "enabled": true, "provenance": "PDF p.10; exact category in AetheriusEnemySystem contract" },
    { "balanceId": "humanoides.reaver", "sourceLabel": "Reaver", "awardMode": "SCALED", "baseXp": 13, "eventXpCategories": ["reaver"], "mappingStatus": "ASSIGNED", "enabled": true, "provenance": "PDF p.10; exact category in AetheriusEnemySystem contract" },
    { "balanceId": "humanoides.forsworn", "sourceLabel": "Forsworn", "awardMode": "SCALED", "baseXp": 15, "eventXpCategories": ["forsworn"], "mappingStatus": "ASSIGNED", "enabled": true, "provenance": "PDF p.10; exact category in AetheriusEnemySystem contract" },
    { "balanceId": "humanoides.warlock", "sourceLabel": "Warlock / Necromancer", "awardMode": "SCALED", "baseXp": 15, "eventXpCategories": ["warlock"], "mappingStatus": "ASSIGNED", "enabled": true, "provenance": "PDF p.10; exact category in AetheriusEnemySystem contract" },
    { "balanceId": "humanoides.cultist", "sourceLabel": "Cultist", "awardMode": "SCALED", "baseXp": 15, "eventXpCategories": ["cultist"], "mappingStatus": "ASSIGNED", "enabled": true, "classificationEquivalents": ["humanoides.warlock"], "provenance": "PDF p.10; classified as Warlock-equivalent by user 2026-09-11; future EnemySystem contract key cultist" },
    { "balanceId": "humanoides.falmer", "sourceLabel": "Falmer", "awardMode": "SCALED", "baseXp": 20, "eventXpCategories": ["falmer"], "mappingStatus": "ASSIGNED", "enabled": true, "difficultyCategory": "MEDIUM", "provenance": "PDF p.10; exact category in AetheriusEnemySystem contract; MEDIUM approved by user 2026-09-11" },
    { "balanceId": "humanoides.vampire", "sourceLabel": "Vampire", "awardMode": "SCALED", "baseXp": 30, "eventXpCategories": ["vampire"], "mappingStatus": "ASSIGNED", "enabled": true, "provenance": "PDF p.10; exact category in AetheriusEnemySystem contract; updated from legacy 16" },
    { "balanceId": "humanoides.thalmor", "sourceLabel": "Thalmor", "awardMode": "SCALED", "baseXp": 18, "eventXpCategories": ["thalmor"], "mappingStatus": "ASSIGNED", "enabled": true, "difficultyCategory": "MEDIUM", "provenance": "Legacy bestiary base XP 18 restored and classified as MEDIUM by explicit user decision on 2026-09-12; supplemental to the primary PDF snapshot" },
    { "balanceId": "mortos-vivos.skeleton", "sourceLabel": "Skeleton", "awardMode": "SCALED", "baseXp": 10, "eventXpCategories": ["skeleton"], "mappingStatus": "ASSIGNED", "enabled": true, "provenance": "PDF p.10; exact category in AetheriusEnemySystem contract; updated from legacy 8" },
    { "balanceId": "mortos-vivos.draugr", "sourceLabel": "Draugr", "awardMode": "SCALED", "baseXp": 18, "eventXpCategories": ["draugr"], "mappingStatus": "ASSIGNED", "enabled": true, "provenance": "PDF p.10; exact category in AetheriusEnemySystem contract" },
    { "balanceId": "mortos-vivos.ghost", "sourceLabel": "Ghost / Phantom", "awardMode": "SCALED", "baseXp": 20, "eventXpCategories": ["ghost"], "mappingStatus": "ASSIGNED", "enabled": true, "provenance": "PDF p.10; exact ghost category; phantom alias remains contract-defined only" },
    { "balanceId": "mortos-vivos.corrupted-shade", "sourceLabel": "Corrupted Shade", "awardMode": "SCALED", "baseXp": 21, "eventXpCategories": ["corrupted_shade"], "mappingStatus": "ASSIGNED", "enabled": true, "difficultyCategory": "HARD", "classificationEquivalents": ["mortos-vivos.draugr"], "provenance": "PDF p.10; classified as HARD Draugr-equivalent by user 2026-09-11" },
    { "balanceId": "mortos-vivos.boneman", "sourceLabel": "Boneman", "awardMode": "SCALED", "baseXp": 22, "eventXpCategories": ["boneman"], "mappingStatus": "ASSIGNED", "enabled": true, "difficultyCategory": "HARD", "classificationEquivalents": ["mortos-vivos.draugr"], "provenance": "PDF p.10; classified as HARD Draugr-equivalent by user 2026-09-11" },
    { "balanceId": "mortos-vivos.mistman", "sourceLabel": "Mistman", "awardMode": "SCALED", "baseXp": 24, "eventXpCategories": ["mistman"], "mappingStatus": "ASSIGNED", "enabled": true, "difficultyCategory": "HARD", "classificationEquivalents": ["mortos-vivos.draugr"], "provenance": "PDF p.10; classified as HARD Draugr-equivalent by user 2026-09-11" },
    { "balanceId": "mortos-vivos.wrathman", "sourceLabel": "Wrathman", "awardMode": "SCALED", "baseXp": 28, "eventXpCategories": ["wrathman"], "mappingStatus": "ASSIGNED", "enabled": true, "difficultyCategory": "HARD", "classificationEquivalents": ["mortos-vivos.draugr"], "provenance": "PDF p.10; classified as HARD Draugr-equivalent by user 2026-09-11" },
    { "balanceId": "mortos-vivos.dragon-priest", "sourceLabel": "Dragon Priest", "awardMode": "FIXED", "fixedXp": 500, "eventXpCategories": ["dragon_priest"], "mappingStatus": "ASSIGNED", "enabled": true, "provenance": "PDF p.10; fixed reward; exact category in AetheriusEnemySystem contract" },
    { "balanceId": "criaturas.ice-wraith", "sourceLabel": "Ice Wraith", "awardMode": "SCALED", "baseXp": 14, "eventXpCategories": ["ice_wraith"], "mappingStatus": "ASSIGNED", "enabled": true, "difficultyCategory": "MEDIUM", "provenance": "PDF p.10 base XP; exact category and MEDIUM classification approved by user 2026-09-12" },
    { "balanceId": "criaturas.chaurus", "sourceLabel": "Chaurus", "awardMode": "SCALED", "baseXp": 15, "eventXpCategories": ["chaurus"], "mappingStatus": "ASSIGNED", "enabled": true, "difficultyCategory": "MEDIUM", "provenance": "PDF p.10; exact category in AetheriusEnemySystem contract; MEDIUM approved by user 2026-09-11" },
    { "balanceId": "criaturas.troll", "sourceLabel": "Troll", "awardMode": "SCALED", "baseXp": 16, "eventXpCategories": ["troll"], "mappingStatus": "ASSIGNED", "enabled": true, "provenance": "PDF p.10; exact category; updated from legacy 20" },
    { "balanceId": "criaturas.chaurus-hunter", "sourceLabel": "Chaurus Hunter", "awardMode": "SCALED", "baseXp": 18, "eventXpCategories": ["chaurus_hunter"], "mappingStatus": "ASSIGNED", "enabled": true, "difficultyCategory": "MEDIUM", "classificationEquivalents": ["criaturas.chaurus"], "provenance": "PDF p.10; included in the user-approved Chaurus MEDIUM family on 2026-09-11" },
    { "balanceId": "criaturas.spriggan", "sourceLabel": "Spriggan", "awardMode": "SCALED", "baseXp": 18, "eventXpCategories": ["spriggan"], "mappingStatus": "ASSIGNED", "enabled": true, "difficultyCategory": "MEDIUM", "classificationEquivalents": ["criaturas.troll", "animais.bear"], "provenance": "PDF p.10; classified as MEDIUM strong-animal equivalent by user 2026-09-11" },
    { "balanceId": "criaturas.ash-spawn", "sourceLabel": "Ash Spawn", "awardMode": "SCALED", "baseXp": 18, "eventXpCategories": ["ash_spawn"], "mappingStatus": "ASSIGNED", "enabled": true, "provenance": "PDF p.10; exact category; updated from legacy 20" },
    { "balanceId": "criaturas.giant", "sourceLabel": "Giant", "awardMode": "SCALED", "baseXp": 20, "eventXpCategories": ["giant"], "mappingStatus": "ASSIGNED", "enabled": true, "provenance": "PDF p.10; exact category; updated from legacy 25" },
    { "balanceId": "criaturas.hagraven", "sourceLabel": "Hagraven", "awardMode": "SCALED", "baseXp": 21, "eventXpCategories": ["hagraven"], "mappingStatus": "ASSIGNED", "enabled": true, "provenance": "PDF p.10; exact category; updated from legacy 24" },
    { "balanceId": "criaturas.wispmother", "sourceLabel": "Wispmother / Wisp", "awardMode": "SCALED", "baseXp": 22, "eventXpCategories": ["wispmother", "wisp"], "mappingStatus": "ASSIGNED", "enabled": true, "difficultyCategory": "MEDIUM", "classificationEquivalents": ["criaturas.troll", "animais.bear"], "provenance": "PDF p.10; Wisp and Wispmother classified as MEDIUM strong-animal equivalents by user 2026-09-11" },
    { "balanceId": "criaturas.gargoyle", "sourceLabel": "Gargoyle", "awardMode": "SCALED", "baseXp": 22, "eventXpCategories": ["gargoyle"], "mappingStatus": "ASSIGNED", "enabled": true, "difficultyCategory": "MEDIUM", "provenance": "PDF p.10; MEDIUM approved by user 2026-09-11" },
    { "balanceId": "criaturas.ash-guardian", "sourceLabel": "Ash Guardian", "awardMode": "SCALED", "baseXp": 26, "eventXpCategories": ["ash_guardian"], "mappingStatus": "ASSIGNED", "enabled": true, "difficultyCategory": "MEDIUM", "provenance": "PDF p.10; MEDIUM approved by user 2026-09-11" },
    { "balanceId": "criaturas.lurker", "sourceLabel": "Lurker", "awardMode": "SCALED", "baseXp": 28, "eventXpCategories": ["lurker"], "mappingStatus": "ASSIGNED", "enabled": true, "provenance": "PDF p.10; exact category in AetheriusEnemySystem contract" },
    { "balanceId": "criaturas.seeker", "sourceLabel": "Seeker", "awardMode": "SCALED", "baseXp": 30, "eventXpCategories": ["seeker"], "mappingStatus": "ASSIGNED", "enabled": true, "provenance": "PDF p.10; exact category in AetheriusEnemySystem contract" },